gene,n_tissue,tissue_1,tissue_2,tissue_3,tissue_4,direct_association.diseaseId,direct_association.score,direct_association.disease,ensembl_ID
VWF,1,LUNG,"","","",Orphanet_166090,0.808688963466547,Von Willebrand disease type 2M: A subtype of type 2 VWD characterized by a bleeding disorder associated with a decrease in the affinity of the Willebrand factor (von Willebrand factor; VWF) for platelets and the subendothelium in the absence of any deficiency of high molecular weight VWF multimers.,ENSG00000110799
DNM1L,1,ADRNL,"","","",Orphanet_330050,0.808656060589526,Lethal encephalopathy due to mitochondrial and peroxisomal fission defect: NA,ENSG00000087470
ASAH1,1,ADRNL,"","","",Orphanet_333,0.808650029863909,"Farber lipogranulomatosis: A rare sphingolipid disorder characterized by a spectrum of clinical signs ranging from the classical triad of painful and progressively deformed joints, subcutaneous nodules, and progressive hoarseness (due to laryngeal involvement) that presents in infancy, to varying phenotypes with respiratory and neurologic involvement.",ENSG00000104763
KRT14,1,COLON,"","","",Orphanet_79396,0.808430301461197,"Epidermolysis bullosa simplex, Dowling-Meara type: A basal subtype of epidermolysis bullosa simplex (EBS) characterized by the presence of generalized vesicles and small blisters in grouped or arcuate configuration.",ENSG00000186847
LONP1,1,COLON,"","","",Orphanet_1458,0.808398853754386,"CODAS syndrome: Codas syndrome is a multiple congenital anomalies syndrome characterized by Cerebral, Ocular, Dental, Auricular and Skeletal anomalies.",ENSG00000196365
CSPP1,1,ADRNL,"","","",Orphanet_475,0.807633551006019,"Joubert syndrome: Joubert syndrome (JS) is characterized by congenital malformation of the brainstem and agenesis or hypoplasia of the cerebellar vermis leading to an abnormal respiratory pattern, nystagmus, hypotonia, ataxia, and delay in achieving motor milestones.",ENSG00000104218
CTC1,1,ADRNL,"","","",Orphanet_313838,0.807608058425346,"Coats plus syndrome: Coats plus syndrome is a pleiotropic multisystem disorder characterized by retinal telangiectasia and exudates, intracranial calcification with leukoencephalopathy and brain cysts, osteopenia with predisposition to fractures, bone marrow suppression, gastrointestinal bleeding and portal hypertension. It is transmitted as an autosomal recessive disease.",ENSG00000178971
INF2,1,LIVER,"","","",EFO_0004236,0.806275082434462,"focal segmental glomerulosclerosis: A renal disorder characterized by sclerotic lesions in the glomeruli. Causes include drugs, viruses, and malignancies (lymphomas), or it may be idiopathic. It presents with asymptomatic proteinuria or nephritic syndrome and it may lead to renal failure.",ENSG00000203485
ASS1,1,LUNG,"","","",Orphanet_187,0.805716324283616,"Citrullinemia: Citrullinemia is an autosomal recessively inherited disorder of urea cycle metabolism and ammonia detoxification characterized by elevated concentrations of serum citrulline and ammonia. The disease presents with a large range of manifestations including neonatal hyperammonemic encephalopathy with lethargy, seizures and coma; hepatic dysfunction in all age groups; episodes of hyperammonemia and neuropsychiatric symptoms in children or adults, or, can be asymptomatic in some cases (detected in newborn screening programs). Citrullinemia is divided into two main groups that are encoded by different genes: citrullinemia type I (comprised of acute neonatal citrullinemia type I and adult-onset citrullinemia type I) and citrin deficiency (comprised of adult-onset citrullinemia type II and neonatal intrahepatic cholestasis due to citrin deficiency).",ENSG00000130707
KRT14,1,COLON,"","","",Orphanet_79400,0.80527767721917,"Localized epidermolysis bullosa simplex: A basal subtype of epidermolysis bullosa simplex (EBS). The disease is characterized by blisters occurring mainly on the palms and soles, exacerbated by warm weather.",ENSG00000186847
SGCB,1,LUNG,"","","",Orphanet_119,0.803714502409722,"Autosomal recessive limb-girdle muscular dystrophy type 2E: Autosomal recessive limb girdle muscular dystrophy type 2E (LGMD2E) is a subtype of autosomal recessive limb girdle muscular dystrophy characterized by a childhood to adolescent onset of progressive pelvic- and shoulder-girdle muscle weakness, particularly affecting the pelvic girdle (adductors and flexors of hip). Usually the knees are the earliest and most affected muscles. In advanced stages, involvement of the shoulder girdle (resulting in scapular winging) and the distal muscle groups are observed. Calf hypertrophy, cardiomyopathy, respiratory impairment, tendon contractures, scoliosis, and exercise-induced myoglobinuria may be observed.",ENSG00000163069
FLT3,1,SMLINT,"","","",EFO_0000222,0.803695315987794,"acute myeloid leukemia: Acute myeloid leukemia (AML) is a group of neoplasms arising from precursor cells committed to the myeloid cell-line differentiation. All of them are characterized by clonal expansion of myeloid blasts. AML manifests by fever, pallor, anemia, hemorrhages and recurrent infections.",ENSG00000122025
ABCA3,1,ADRNL,"","","",Orphanet_217563,0.801996221775787,Neonatal acute respiratory distress with surfactant metabolism deficiency: NA,ENSG00000167972
HCCS,1,HEART,"","","",Orphanet_2556,0.80191391166623,"Microphthalmia with linear skin defects syndrome: A genetic condition that affects the eyes and skin. It is mainly found in females and is characterized by small or poorly developed eyes (microphthalmia) and characteristic linear skin markings on the head and neck. The signs and symptoms of this condition may include abnormalities of the brain, heart, and genitourinary system. Other symptoms may include short stature, developmental delay, and finger and toenails that do not grow normally (nail dystrophy). MLS syndrome is typically caused by either a deletion of certain genetic material on the p (short) arm of the X chromosome or by a mutation in the HCCS gene. In some cases, it may be caused by mutations in the COX7B and NDUFB11 genes, (also located on the X chromosome). According to the mutated gene, the disease may be classified in three subtypes. This condition is inherited in an X-linked manner and is thought to result in serious early developmental concerns in males, leading to almost no males with this condition surviving to delivery.Although there is no specific treatment or cure for MLS syndrome, there may be ways to manage the symptoms. A team of doctors is often needed to figure out the treatment options based on each person's symptoms.",ENSG00000004961
PCYT1A,1,HEART,"","","",Orphanet_85167,0.801647579797493,"Spondylometaphyseal dysplasia - cone-rod dystrophy: Spondylometaphyseal dysplasia-cone-rod dystrophy syndrome is characterised by the association of spondylometaphyseal dysplasia (marked by platyspondyly, shortening of the tubular bones and progressive metaphyseal irregularity and cupping), with postnatal growth retardation and progressive visual impairment due to cone-rod dystrophy. So far, it has been described in eight individuals. Transmission appears to be autosomal recessive.",ENSG00000161217
KIF21A,1,LIVER,"","","",Orphanet_45358,0.801537680538929,Congenital fibrosis of extraocular muscles: NA,ENSG00000139116
PIGV,1,SPLEEN,"","","",Orphanet_247262,0.801333325523015,Hyperphosphatasia-intellectual disability syndrome: NA,ENSG00000060642
AGL,1,HEART,"","","",Orphanet_366,0.800517211840972,"Glycogen storage disease due to glycogen debranching enzyme deficiency: An autosomal recessive metabolic disorder due to deficient expression of amylo-1,6-glucosidase (one part of the glycogen debranching enzyme system). The clinical course of the disease is similar to that of glycogen storage disease type I, but milder. Massive hepatomegaly, which is present in young children, diminishes and occasionally disappears with age. Levels of glycogen with short outer branches are elevated in muscle, liver, and erythrocytes. Six subgroups have been identified, with subgroups Type IIIa and Type IIIb being the most prevalent.",ENSG00000162688
SMOC1,1,ADRNL,"","","",Orphanet_1106,0.80014211565312,"Microphthalmia with limb anomalies: Microphthalmia with limb anomalies, also known as ophthalmo-acromelic syndrome (OAS), is a rare developmental disorder characterized by bilateral microphthalmia or anophthalmia, synostosis, syndactyly, oligodactyly and/or polydactyly.",ENSG00000198732
