gene,n_tissue,tissue_1,tissue_2,tissue_3,tissue_4,tissue_5,tissue_6,direct_association.diseaseId,direct_association.score,direct_association.disease,ensembl_ID
SLC6A8,3,HEART,LIVER,LUNG,"","","",Orphanet_52503,0.833485622870617,"X-linked creatine transporter deficiency: X-linked creatine transporter deficiency (CRTR-D) is a creatine deficiency syndrome characterized clinically by global developmental delay/ intellectual disability (DD/ID) with prominent speech/language delay, autistic behavior and seizures.",ENSG00000130821
TUBA1A,3,COLON,HEART,SPLEEN,"","","",Orphanet_171680,0.808038858814008,"Lissencephaly due to TUBA1A mutation: Lissencephaly (LIS) due to TUBA1A mutation is a congenital cortical development anomaly due to abnormal neuronal migration involving neocortical and hippocampal lamination, corpus callosum, cerebellum and brainstem. A large clinical spectrum can be observed, from children with severe epilepsy and intellectual and motor deficit to cases with severe cerebral dysgenesis in the antenatal period leading to pregnancy termination due to the severity of the prognosis.",ENSG00000167552
APOB,3,COLON,KIDNEY,LUNG,"","","",Orphanet_31154,0.787151958972397,Hypobetalipoproteinemia: A group of lipoprotein metabolism disorders that are characterized by permanently low levels (below the 5th percentile) of apolipoprotein B and LDL cholesterol.,ENSG00000084674
TUBB2A,3,ADRNL,COLON,SPLEEN,"","","",Orphanet_183506,0.757011485177841,Genetic central nervous system malformation: NA,ENSG00000137267
APOB,3,COLON,KIDNEY,LUNG,"","","",MONDO_0007751,0.618532951243147,"hypercholesterolemia, autosomal dominant, type B: NA",ENSG00000084674
HMOX1,3,ADRNL,HEART,LIVER,"","","",MONDO_0013536,0.617331816715421,heme oxygenase 1 deficiency: NA,ENSG00000100292
TUBA1A,3,COLON,HEART,SPLEEN,"","","",Orphanet_102011,0.554534039740246,Lissencephaly type 3: NA,ENSG00000167552
SERPINH1,3,ADRNL,HEART,LUNG,"","","",MONDO_0012511,0.552809333751717,preterm premature rupture of the membranes: A female reproductive system disease characterized by rupture of chorioamniotic membranes before 37 weeks of gestation.,ENSG00000149257
APOB,3,COLON,KIDNEY,LUNG,"","","",MONDO_0014252,0.503876790581939,familial hypobetalipoproteinemia 1: Any hypobetalipoproteinemia in which the cause of the disease is a mutation in the APOB gene.,ENSG00000084674
TUBA1A,3,COLON,HEART,SPLEEN,"","","",Orphanet_45358,0.436104228527948,Congenital fibrosis of extraocular muscles: NA,ENSG00000167552
APOB,3,COLON,KIDNEY,LUNG,"","","",EFO_0010222,0.428420713441675,ceramide measurement: A quantification of ceramides.,ENSG00000084674
TUBA1A,3,COLON,HEART,SPLEEN,"","","",HP_0002536,0.340013466309926,"Abnormal cortical gyration: An abnormality of the gyri (i.e., the ridges) of the cerebral cortex of the brain.",ENSG00000167552
TUBA1A,3,COLON,HEART,SPLEEN,"","","",Orphanet_1935,0.340013466309926,"Early myoclonic encephalopathy: Early myoclonic encephalopathy (EME) is characterized clinically by the onset of fragmentary myoclonus appearing in the first month of life, often associated with erratic focal seizures and a suppression-burst EEG pattern.",ENSG00000167552
TUBA1A,3,COLON,HEART,SPLEEN,"","","",Orphanet_62,0.340013466309926,"Autosomal recessive limb-girdle muscular dystrophy type 2D: Autosomal recessive limb-girdle muscular dystrophy type 2D (LGMD2D) is a subtype of autosomal recessive limb-girdle muscular dystrophy characterized by childhood onset of progressive proximal weakness of the shoulder and pelvic girdle muscles, resulting in difficulty walking, scapular winging, calf hypertrophy and contractures of the Achilles tendon, which lead to a tiptoe gait pattern. Cardiac and respiratory involvement is rare.",ENSG00000167552
TUBA1A,3,COLON,HEART,SPLEEN,"","","",Orphanet_269570,0.332621869216232,Genetic syndrome with a Dandy-Walker malformation as major feature: NA,ENSG00000167552
TUBA1A,3,COLON,HEART,SPLEEN,"","","",EFO_0020030,0.277020594005022,tubulinopathy: A congenital nervous system abnormality characterized by complex cortical malformations including in most cases dysmorphic basal ganglia that has_material_basis_in mutation in one or more of the tubulin genes.,ENSG00000167552
VSIR,3,COLON,LUNG,SMLINT,"","","",EFO_0010911,0.24217436386003,C-X-C motif chemokine 16 measurement: Quantification of the amount of C-X-C motif chemokine 16 in a sample,ENSG00000107738
PDZD2,3,COLON,HEART,LUNG,"","","",EFO_0009472,0.220797318168822,tympanic membrane perforation: Presence of a hole or tear in the tympanic membrane (eardrum).,ENSG00000133401
GLB1,2,ADRNL,COLON,"","","","",Orphanet_79255,0.842745674887448,GM1 gangliosidosis type 1: GM1 gangliosidosis type 1 is the severe infantile form of GM1 gangliosidosis (see this term) with variable neurological and systemic manifestations.,ENSG00000170266
FOXP3,2,HEART,SPLEEN,"","","","",Orphanet_37042,0.840045550521703,"Immune dysregulation-polyendocrinopathy-enteropathy-X-linked syndrome: Immunodysregulation - polyendocrinopathy - enteropathy - X-linked (IPEX) syndrome is a severe congenital systemic autoimmune disease characterized by refractory diarrhea, endocrinopathies, cutaneous involvement, and infections.",ENSG00000049768
GLB1,2,ADRNL,COLON,"","","","",Orphanet_309310,0.836263597196971,Mucopolysaccharidosis type 4B: A rare autosomal recessive lysosomal storage disease caused by deficiency of the enzyme beta galactosidase. It is characterized by skeletal dysplasia and short stature.,ENSG00000170266
GLB1,2,ADRNL,COLON,"","","","",Orphanet_79256,0.832350682432209,"GM1 gangliosidosis type 2: GM1 gangliosidosis type 2 is a clinically variable, infancy or childhood-onset form of GM1 gangliosidosis characterized by normal early development and psychomotor regression between seven months and three years of age.",ENSG00000170266
DPYD,2,ADRNL,KIDNEY,"","","","",Orphanet_1675,0.82310830021591,"Dihydropyrimidine dehydrogenase deficiency: Dihydropyrimidine dehydrogenase (DPD) deficiency isaconditionin which the body cannot break down the nucleotides thymine and uracil. DPD deficiency can have a wide range of severity; some individuals may have various neurological problems, while others have no signsand symptoms. Signs and symptoms in severely affected individuals begin in infancy and may include seizures, intellectual disability, microcephaly, increased muscle tone (hypertonia), delayed motor skills, and autistic behavior. All individuals with the condition, regardless of the presence or severity of symptoms, are at risk for severe, toxic reactions to drugs called fluoropyrimidines which are used to treat cancer. Individuals with no symptoms may be diagnosed only by laboratory testing or after exposure to fluoropyrimidines. DPD deficiency is caused by mutations in the DPYD gene and is inherited in an autosomal recessive manner.",ENSG00000188641
GLB1,2,ADRNL,COLON,"","","","",Orphanet_79257,0.819428499869016,"GM1 gangliosidosis type 3: GM1 gangliosidosis type 3 is a mild, chronic, adult form of GM1 gangliosidosis (see this term) characterized by onset generally during childhood or adolescence and by cerebellar dysfunction.",ENSG00000170266
NBEAL2,2,HEART,SPLEEN,"","","","",Orphanet_721,0.805556881630223,"Gray platelet syndrome: Gray platelet syndrome (GPS) is a rare inherited bleeding disorder characterized by macrothrombocytopenia, myelofibrosis, splenomegaly and typical gray appearance of platelets on Wright stained peripheral blood smear.",ENSG00000160796
GATA3,2,HEART,SPLEEN,"","","","",Orphanet_2237,0.803845791128441,"Hypoparathyroidism - deafness - renal disease: The HDR syndrome is an inherited condition consisting of hypoparathyroidism, sensorineural deafness and renal disease.",ENSG00000107485
TGFBR2,2,ADRNL,COLON,"","","","",Orphanet_284973,0.80121242260001,Marfan syndrome type 2: NA,ENSG00000163513
HSD11B2,2,ADRNL,KIDNEY,"","","","",Orphanet_320,0.786310088312328,"Apparent mineralocorticoid excess: Apparent mineralocorticoid excess (AME) is a rare form of pseudohyperaldosteronism characterized by very early-onset and severe hypertension, associated with low renin levels and hypoaldosteronism.",ENSG00000176387
PNP,2,ADRNL,SPLEEN,"","","","",Orphanet_760,0.780830728292502,"Purine nucleoside phosphorylase deficiency: Purine nucleoside phosphorylase deficiency is a purine metabolism disorder resulting in combined T and B cell immunodeficiency that results in recurrent infections. Children are particularly prone to viral infections (chicken pox, mumps, cytomegalovirus) and vaccines, but suppurant bacterial infections have also been noted. One third of all patients have anemia, and 2/3 have neurological signs (ataxia, spastic tetraplegy and tremor).",ENSG00000198805
KIAA1109,2,LIVER,SPLEEN,"","","","",MONDO_0060631,0.778128491706504,Alkuraya-Kucinskas syndrome: NA,ENSG00000138688
CRLF1,2,HEART,LUNG,"","","","",Orphanet_157820,0.774887251897393,"Cold-induced sweating syndrome: Cold-induced sweating syndrome (CISS) is characterized by profuse sweating (involving the chest, face, arms and trunk) induced by cold ambient temperature.",ENSG00000006016
PDSS1,2,ADRNL,COLON,"","","","",Orphanet_254898,0.768725658103247,"Deafness - encephaloneuropathy - obesity - valvulopathy: Deafness-encephaloneuropathy-obesity-valvulopathy syndrome is a rare mitochondrial disease with marked clinical variability typically characterized by encephalomyopathy, kidney disease (nephrotic syndrome), optic atrophy, early-onset deafness, pancytopenia, obesity, and cardiac disease (valvulopathy). Additionally, macrocephaly, intellectual disability, hyperlactatemia, elevated lactate/pyruvate ratio, insulin-dependent diabetes, livedo reticularis, liver dysfunction and seizures have also been associated.",ENSG00000148459
CRLF1,2,HEART,LUNG,"","","","",Orphanet_1545,0.766684649919039,"Crisponi syndrome: Crisponi syndrome (CS) is a severe disorder characterized by muscular contractions at birth, intermittent hyperthermia, facial abnormalities and camptodactyly.",ENSG00000006016
SLC39A8,2,ADRNL,LUNG,"","","","",MONDO_0014746,0.765703251655651,SLC39A8-CDG: NA,ENSG00000138821
ZAP70,2,SMLINT,SPLEEN,"","","","",Orphanet_911,0.763975909386787,"Combined immunodeficiency due to ZAP70 deficiency: Combined immunodeficiency due to ZAP70 deficiency is a very rare, severe, genetic, combined immunodeficiency disorder characterized by lymphocytosis, decreased peripheral CD8+ T-cells, and presence of normal circulating CD4+ T-cells, leading to immune dysfunction.",ENSG00000115085
FMO3,2,LUNG,SPLEEN,"","","","",MONDO_0011182,0.760927703580152,"trimethylaminuria: A rare inborn error of metabolism characterized by the presence of large amounts of trimethylamine in urine, sweat, and breath, resulting in a fishy body odor in affected individuals.",ENSG00000007933
TUBB,2,HEART,SPLEEN,"","","","",Orphanet_183506,0.754593651254011,Genetic central nervous system malformation: NA,ENSG00000196230
DPM1,2,ADRNL,HEART,"","","","",Orphanet_79322,0.751835722226018,"DPM1-CDG: The CDG (Congenital Disorders of Glycosylation) syndromes are a group of autosomal recessive disorders affecting glycoprotein synthesis. CDG syndrome type Ie is characterised by psychomotor delay, seizures, hypotonia, facial dysmorphism and microcephaly. Ocular anomalies are also very common.",ENSG00000000419
LIFR,2,COLON,KIDNEY,"","","","",Orphanet_3206,0.746993004776622,"Stüve-Wiedemann syndrome: A rare autosomal recessive congenital primary skeletal dysplasia, characterized by small stature, bowing of the long bones, camptodactyly, hyperthermic episodes, respiratory distress/apneic episodes and feeding difficulties that usually lead to early mortality.",ENSG00000113594
SLC12A6,2,COLON,SPLEEN,"","","","",Orphanet_1496,0.744645063640786,"Corpus callosum agenesis - neuronopathy: Corpus callosum agenesis-neuropathy is a neurodegenerative disorder characterized by severe progressive sensorimotor neuropathy beginning in infancy with resulting hypotonia, areflexia, amyotrophy and variable degrees of dysgenesis of the corpus callosum. Additional features include mild-to-severe intellectual and developmental delays, and psychiatric manifestations that include paranoid delusions, depression, hallucinations, and ""autistic-like"" features. Affected individuals are usually wheelchair restricted in the second decade of life and die in the third decade of life. The disease is inherited as an autosomal recessive trait.",ENSG00000140199
VCAN,2,ADRNL,SPLEEN,"","","","",Orphanet_898,0.731213283669068,"Wagner disease: Wagner disease is a rare hereditary vitreoretinopathy characterized by an anomaleous vitreous associated with myopia, cataract, chorioretinal atrophy, and peripheral tractional or rhegmatogenous retinal detachment.",ENSG00000038427
GSN,2,KIDNEY,SMLINT,"","","","",Orphanet_85448,0.726046545167165,"Familial amyloidosis, Finnish type: NA",ENSG00000148180
SEC24D,2,ADRNL,COLON,"","","","",Orphanet_2050,0.725914089097047,"Cole-Carpenter syndrome: Cole-Carpenter syndrome is an extremely rare form of bone dysplasia characterized by the features of osteogenesis imperfecta such as bone fragility associated with multiple fractures, bone deformities (metaphyseal irregularities and bowing of the long bones) and blue sclera, in association with growth failure, craniosynostosis, hydrocephalus, ocular proptosis, and distinctive facial features (e.g. frontal bossing, midface hypoplasia, and micrognathia).",ENSG00000150961
NTRK2,2,HIPPOC,LUNG,"","","","",MONDO_0013483,0.719328397967341,"obesity, hyperphagia, and developmental delay: NA",ENSG00000148053
FMO3,2,LUNG,SPLEEN,"","","","",HP_0003614,0.709453075958308,Trimethylaminuria: Increased concentration of trimethylamine in the urine.,ENSG00000007933
APOA1,2,COLON,LIVER,"","","","",Orphanet_425,0.706076798514964,"Apolipoprotein A-I deficiency: Apolipoprotein AI (Apo A-I) deficiency is a rare lipoprotein metabolism disorder characterized biochemically by complete absence of apolipoprotein AI and extremely low plasma high density lipoprotein (HDL) cholesterol, and clinically by corneal opacities and xanthomas complicated with premature coronary heart disease (CHD).",ENSG00000118137
BCL11B,2,COLON,SPLEEN,"","","","",MONDO_0060763,0.705580574546984,"intellectual developmental disorder with speech delay, dysmorphic facies, and t-cell abnormalities: Any BAFopathy in which the cause of the disease is a mutation in the BCL11B gene.",ENSG00000127152
MRPS2,2,ADRNL,COLON,"","","","",MONDO_0054781,0.705505017281878,combined oxidative phosphorylation deficiency 36: NA,ENSG00000122140
TUBB,2,HEART,SPLEEN,"","","","",Orphanet_2505,0.686186596864597,Multiple benign circumferential skin creases on limbs: NA,ENSG00000196230
DHDDS,2,ADRNL,HEART,"","","","",MONDO_0044326,0.678141367674667,"developmental delay and seizures with or without movement abnormalities: DEDSM is a neurodevelopmental disorder characterized by global developmental delay, variable intellectual disability, and early-onset seizures with a myoclonic component. Most patients have delayed motor development and show abnormal movements, including ataxia, dystonia, and tremor (summary by {1:Hamdan et al., 2017}).",ENSG00000117682
SLC39A8,2,ADRNL,LUNG,"","","","",EFO_0005546,0.667506024016739,congenital disorder of glycosylation type II: A congenital disorder of glycosylation that involves malfunctioning trimming/processing of the protein-bound oligosaccharide chain.,ENSG00000138821
TGFBR2,2,ADRNL,COLON,"","","","",Orphanet_144,0.63030395664557,"Lynch syndrome: An autosomal dominant hereditary neoplastic syndrome characterized by the development of colorectal carcinoma and a high risk of developing endometrial carcinoma, gastric carcinoma, ovarian carcinoma, renal pelvis carcinoma, and small intestinal carcinoma. Patients often develop colorectal carcinomas at an early age (mean, 45 years). In the majority of the cases the lesions arise from the proximal colon. At the molecular level, high-frequency microsatellite instability is present.",ENSG00000163513
VIM,2,KIDNEY,LUNG,"","","","",Orphanet_98984,0.618532951243147,Pulverulent cataract: A cataract that has material basis in heterozygous mutation in the CRYGC gene on chromosome 2q33.,ENSG00000026025
GAA,2,ADRNL,HEART,"","","","",Orphanet_308604,0.595686049804261,"Glycogen storage disease due to acid maltase deficiency, adult onset: Glycogen storage disease due to acid maltase deficiency, late onset (AMDL), a form of Glycogen storage disease due to acid maltase deficiency (AMD), a degenerative metabolic myopathy particularly affecting respiratory and skeletal muscles, is characterized by an accumulation of glycogen in lysosomes.",ENSG00000171298
VIM,2,KIDNEY,LUNG,"","","","",Orphanet_98992,0.595434210325353,Partial congenital cataract: NA,ENSG00000026025
GAA,2,ADRNL,HEART,"","","","",Orphanet_308552,0.586034691014211,"Glycogen storage disease due to acid maltase deficiency, infantile onset: Glycogen storage disease due to acid maltase deficiency, infantile onset is the most severe form of glycogen storage disease due to acid maltase deficiency, characterized by cardiomegaly with respiratory distress, muscle weakness and feeding difficulties. It is often fatal.",ENSG00000171298
UGP2,2,HEART,LIVER,"","","","",MONDO_0032895,0.583936170401829,"developmental and epileptic encephalopathy, 83: NA",ENSG00000169764
ADD3,2,COLON,SPLEEN,"","","","",Orphanet_210141,0.578392472581558,Inherited congenital spastic tetraplegia: A type of spastic cerebral palsy characterized by increased muscle tone of all four extremities.,ENSG00000148700
MMP9,2,KIDNEY,SMLINT,"","","","",Orphanet_1040,0.565416865165455,"Metaphyseal anadysplasia: Metaphyseal anadysplasia is a very rare form of metaphyseal dysplasia characterized by short stature, rhizomelic micromelia and a mild varus deformity of the legs evident from the first months of life, that is associated with radiological features of severe metaphyseal changes (irregularities, widening and marginal blurring) in long bones, most prominent in proximal femurs, and generalized osteopenia, and that usually spontaneously resolves by the age of three years. Severe autosomal dominant and milder recessive variants have been observed.",ENSG00000100985
ERBB3,2,KIDNEY,LUNG,"","","","",Orphanet_137776,0.534447292288124,"Lethal congenital contracture syndrome type 2: Lethal congenital contracture syndrome type 2 is a rare arthrogryposis syndrome characterized by multiple congenital contactures (typically extended elbows and flexed knees), micrognathia, anterior horn cell degeneration, skeletal muscle atrophy (mainly in the lower limbs), presence of a markedly distended urinary bladder and absence of hydrops, pterygia and bone fractures. Other craniofacial (e.g. cleft palate, facial palsy) and ocular (e.g. anisocoria, retinal detachment) anomalies may be additionally observed. The disease is usually neonatally lethal however, survival into adolescence has been reported.",ENSG00000065361
IVNS1ABP,2,HEART,LUNG,"","","","",MONDO_0033542,0.528704514340615,immunodeficiency 70: NA,ENSG00000116679
SSTR3,2,ADRNL,SPLEEN,"","","","",EFO_1000852,0.520044738754627,carcinoid syndrome: NA,ENSG00000278195
GLP1R,2,LUNG,SPLEEN,"","","","",HP_0003074,0.508368977530809,Hyperglycemia: An increased concentration of glucose in the blood.,ENSG00000112164
CRYBB1,2,COLON,HEART,"","","","",Orphanet_98991,0.503177839099684,Nuclear cataract: NA,ENSG00000100122
HSD11B2,2,ADRNL,KIDNEY,"","","","",HP_0004398,0.503039246654177,Peptic ulcer: An ulcer of the gastrointestinal tract.,ENSG00000176387
SSTR3,2,ADRNL,SPLEEN,"","","","",EFO_0009545,0.490719918164687,esophageal varices: Abnormally dilated veins of the esophagus.,ENSG00000278195
PPIA,2,COLON,SPLEEN,"","","","",EFO_0007141,0.485688897160978,"allergic conjunctivitis: A chronic conjunctivitis that is an inflammation of the conjunctiva involing red, itchy, and watery eyes a resulting from an exposure to an allergen or an irritant.",ENSG00000196262
SSTR3,2,ADRNL,SPLEEN,"","","","",EFO_1001110,0.484180407958183,pituitary-dependent Cushing's disease: A disease of the PITUITARY GLAND characterized by the excess amount of ADRENOCORTICOTROPIC HORMONE secreted. This leads to hypersecretion of cortisol (HYDROCORTISONE) by the ADRENAL GLANDS resulting in CUSHING SYNDROME.,ENSG00000278195
AIMP2,2,ADRNL,COLON,"","","","",MONDO_0054817,0.478492984638868,"leukodystrophy, hypomyelinating, 17: NA",ENSG00000106305
APOA1,2,COLON,LIVER,"","","","",Orphanet_31153,0.468456357901057,Hypoalphalipoproteinemia: A metabolic disorder characterized by deficiency of high density (alpha) lipoprotein in the blood.,ENSG00000118137
PNP,2,ADRNL,SPLEEN,"","","","",Orphanet_317416,0.461974818355877,"T-B+ severe combined immunodeficiency: T-B+ severe combined immunodeficiency (SCID) is a group of rare monogenic primary immunodeficiency disorders characterized by a lack of functional peripheral T lymphocytes with presence of B lymphocytes, resulting in early-onset severe respiratory viral, bacterial or fungal infections, diarrhea and failure to thrive.",ENSG00000198805
PPIA,2,COLON,SPLEEN,"","","","",MONDO_0004768,0.461974818355877,keratoconjunctivitis: Inflammation of both the cornea and the conjunctiva.,ENSG00000196262
PPIA,2,COLON,SPLEEN,"","","","",Orphanet_231214,0.461974818355877,Beta-thalassemia major: Beta-thalassemia (BT) major is a severe early-onset form of BT characterized by severe anemia requiring regular red blood cell transfusions.,ENSG00000196262
FAAH,2,COLON,SPLEEN,"","","","",EFO_0003943,0.461974818355877,humerus fracture: A traumatic or pathologic injury to the humerus in which the continuity of the humerus is broken.,ENSG00000117480
FAAH,2,COLON,SPLEEN,"","","","",HP_0011868,0.461974818355877,Sciatica: Pain in the lower back and hip radiating in the distribution of the sciatic nerve.,ENSG00000117480
PPIA,2,COLON,SPLEEN,"","","","",EFO_0006927,0.456044372304578,severe aplastic anemia: Severe aplastic anemia (SAA) is a disease in which the bone marrow does not make enough blood cells for the body.,ENSG00000196262
APOA1,2,COLON,LIVER,"","","","",Orphanet_31150,0.455090355096953,"Tangier disease: Tangier disease (TD) is a rare lipoprotein metabolism disorder characterized biochemically by an almost complete absence of plasma high-density lipoproteins (HDL), and clinically by liver, spleen, lymph node and tonsil enlargement along with peripheral neuropathy in children and adolescents, and, occasionally, cardiovascular disease in adults.",ENSG00000118137
LIFR,2,COLON,KIDNEY,"","","","",Orphanet_2190,0.453753437492613,Congenital hydronephrosis: Congenital hydronephrosis is a renal urinary disease characterized by distension and dilation of the renal pelvis and calyces secondary to various congenital obstructive malformations of the kidneys and urinary tract that can evolve to renal atrophy.,ENSG00000113594
ERBB3,2,KIDNEY,LUNG,"","","","",MONDO_0007573,0.436104228527948,"acute erythroleukemia, familial: An instance of acute erythroleukemia that is caused by an inherited modification of the individual's genome.",ENSG00000065361
PPIA,2,COLON,SPLEEN,"","","","",EFO_0004276,0.434256329254525,Stevens-Johnson syndrome: Stevens-Johnson syndrome is a limited form of toxic epidermal necrolysis characterized by destruction and detachment of the skin epithelium and mucous membranes involving less than 10% of the body surface area.,ENSG00000196262
PPIA,2,COLON,SPLEEN,"","","","",MONDO_0001705,0.434256329254525,"pure red-cell aplasia: A disease characterized by normocytic, normochromic anemia, low hematocrit, reticulocytopenia, and selective erythroid hypoplasia.",ENSG00000196262
FAAH,2,COLON,SPLEEN,"","","","",EFO_1000831,0.434256329254525,bacterial meningitis: Inflammation of the membranes surrounding the brain and spinal cord due to a bacterial infection.,ENSG00000117480
FAAH,2,COLON,SPLEEN,"","","","",EFO_1001476,0.434256329254525,streptococcal infection: Infections with bacteria of the genus STREPTOCOCCUS.,ENSG00000117480
INPP4B,2,ADRNL,SPLEEN,"","","","",EFO_0004792,0.428885763879291,"plasminogen activator inhibitor 1 measurement: Is a quantification of plasminogen activator inhibitor 1 a serine protease inhibitor. This inhibitor acts as 'bait' for tissue plasminogen activator, urokinase, protein C and matriptase-3/TMPRSS7. Its rapid interaction with PLAT may function as a major control point in the regulation of fibrinolysis",ENSG00000109452
SSTR3,2,ADRNL,SPLEEN,"","","","",HP_0002014,0.391110814393536,Diarrhea: Abnormally increased frequency of loose or watery bowel movements.,ENSG00000278195
GLP1R,2,LUNG,SPLEEN,"","","","",MONDO_0015183,0.390242961699053,"short bowel syndrome: Short bowel syndrome is an intestinal failure due to either a congenital defect, intestinal infarction or extensive surgical resection of the intestinal tract that results in a functional small intestine of less than 200cm in length and is characterized by diarrhea, nutrient malabsoption, bowel dilation and dysmobility.",ENSG00000112164
SSTR3,2,ADRNL,SPLEEN,"","","","",EFO_0000232,0.389792096798919,"adenoma: A neoplasm arising from the epithelium. It may be encapsulated or non-encapsulated but non-invasive. The neoplastic epithelial cells may or may not display cellular atypia or dysplasia. In the gastrointestinal tract, when dysplasia becomes severe it is sometimes called carcinoma in situ. Representative examples are pituitary gland adenoma, follicular adenoma of the thyroid gland, and adenomas (or adenomatous polyps) of the gastrointestinal tract.",ENSG00000278195
FAAH,2,COLON,SPLEEN,"","","","",EFO_0600028,0.389666540551535,N-acylethanolamine measurement: Quantification of the levels of N-acylethanolamine in a sample.,ENSG00000117480
PPIA,2,COLON,SPLEEN,"","","","",EFO_0007183,0.381376868787724,bronchiolitis obliterans: A obstructive lung disease involving obstruction of the bronchioles due to inflammation and fibrosis which occurs as a complication of various lung conditions or physiological insults.,ENSG00000196262
