gene,n_tissue,tissue_1,tissue_2,tissue_3,tissue_4,tissue_5,tissue_6,direct_association.diseaseId,direct_association.score,direct_association.disease,ensembl_ID
CAPN1,1,ADRNL,"","","","","",EFO_0009019,0.757482459786173,"Autosomal recessive spastic paraplegia type 76: Spastic paraplegia-76 is an autosomal recessive neurologic disorder characterized by young-adult onset of slowly progressive spasticity of the lower limbs resulting in gait difficulties. Most affected individuals have upper limb involvement and additional features such as foot deformities and dysarthria. Cognition is unaffected (summary by Gan-Or et al., 2016).",ENSG00000014216
GALE,1,COLON,"","","","","",Orphanet_352,0.757440899128369,"Galactosemia: Galactosemia is a group of rare genetic metabolic disorders characterized by impaired galactose metabolism resulting in a range of variable manifestations encompassing a severe, life-threatening disease (classic galactosemia), a rare mild form (galactokinase deficiency) causing cataract, and a very rare form with variable severity (galactose epimerase deficiency) resembling classic galactosemia in the severe form (see these terms).",ENSG00000117308
DSP,1,HEART,"","","","","",MONDO_0011831,0.757216328466543,arrhythmogenic right ventricular dysplasia 8: Any arrhythmogenic right ventricular cardiomyopathy in which the cause of the disease is a mutation in the DSP gene.,ENSG00000096696
VWF,1,LUNG,"","","","","",Orphanet_166078,0.757153552991357,Von Willebrand disease type 1: Type 1 von Willebrand disease (type 1 VWD) is a form of VWD characterized by a bleeding disorder associated with a partial quantitative plasmatic deficiency of an otherwise structurally and functionally normal Willebrand factor (von Willebrand factor; VWF).,ENSG00000110799
MTHFR,1,HEART,"","","","","",MONDO_0004737,0.75715016571656,"homocystinuria: An autosomal recessive inherited metabolic disorder caused by mutations in the CBS, MTHFR, MTR, and MTRR genes. It is characterized by abnormalities in the methionine metabolism and is associated with deficiency of cystathionine synthase. It results in the accumulation of homocysteine in the serum. It may affect the cardiovascular, musculoskeletal and the central nervous systems.",ENSG00000177000
GK,1,KIDNEY,"","","","","",Orphanet_308993,0.756370169851867,Glycerol kinase deficiency: An acquired metabolic disease that is has its basis in the disruption of glycerol kinase activity.,ENSG00000198814
DYSF,1,HEART,"","","","","",Orphanet_178400,0.755678715766056,Distal myopathy with anterior tibial onset: NA,ENSG00000135636
CFH,1,COLON,"","","","","",Orphanet_200421,0.754725055122302,Immunodeficiency with factor H anomaly: NA,ENSG00000000971
DDX11,1,ADRNL,"","","","","",Orphanet_280558,0.754592056469314,"Warsaw breakage syndrome: A syndrome mainly characterized by severe growth retardation and microcephaly. It is a new form of cohesinopathy showing defects in sister chromatid cohesion and hypersensitivity to chemicals that induce replication stress, thus combining distinct cytogenetic features seen in Roberts syndrome and Fanconi anemia, respectively. It has material basis in homozygous or compound heterozygous mutation in the DDX11 gene on chromosome 12p11.",ENSG00000013573
KAT6B,1,COLON,"","","","","",Orphanet_3047,0.753824907848043,"Blepharophimosis-intellectual disability syndrome, SBBYS type: Blepharophimosis-intellectual disability syndrome, SBBYS type is characterised by the association of congenital hypothyroidism, facial dysmorphism (microcephaly, blepharophimosis, a bulbous nose, thin lip, low-set ears and micrognathia), postaxial polydactyly and severe intellectual deficit. Less than 20 cases have been reported so far. Cryptorchidism is present in affected males. Some patients also have cardiac anomalies (interventricular communication), hypotonia and growth delay. Autosomal recessive inheritance has been suggested.",ENSG00000156650
SLC5A1,1,LUNG,"","","","","",Orphanet_35710,0.753452873911619,"Glucose-galactose malabsorption: Glucose-galactose malabsorption (GGM) is a very rare, potentially lethal, genetic metabolic disease characterized by impaired glucose-galactose absorption resulting in severe watery diarrhea and dehydration with onset inthe neonatal period.",ENSG00000100170
IFT52,1,COLON,"","","","","",Orphanet_1505,0.753302789374506,Short rib-polydactyly syndrome: Short rib-polydactyly syndromes are a group of bone malformations characterized by a narrow thorax and polydactyly (usually preaxial).,ENSG00000101052
CFH,1,COLON,"","","","","",Orphanet_93581,0.753169626849315,Atypical hemolytic-uremic syndrome with anti-factor H antibodies: NA,ENSG00000000971
SLC25A13,1,COLON,"","","","","",Orphanet_247598,0.753150706126849,"Neonatal intrahepatic cholestasis due to citrin deficiency: Neonatal intrahepatic cholestasis due to citrin deficiency is a mild subtype of citrin deficiency characterized clinically by low birth weight, failure to thrive, transient intrahepatic cholestasis, multiple aminoacidemia, galactosemia, hypoproteinemia, hepatomegaly, decreased coagulation factors, hemolytic anemia, variable but mostly mild liver dysfunction, and hypoglycemia.",ENSG00000004864
SLC25A13,1,COLON,"","","","","",Orphanet_247585,0.752284850391425,"Citrullinemia type II: Citrullinemia type II is a severe subtype of citrin deficiency characterized clinically by adult onset (20 and 50 years of age), recurrent episodes of hyperammonemia and associated neuropsychiatric symptoms such as nocturnal delirium, confusion, restlessness, disorientation, drowsiness, memory loss, abnormal behavior (aggression, irritability, and hyperactivity), seizures, and coma.",ENSG00000004864
ECEL1,1,ADRNL,"","","","","",Orphanet_329457,0.751623896292035,"Distal arthrogryposis type 5D: Distal arthrogryposis type 5D is a rare subtype of distal arthrogryposis syndrome characterized by arthrogryposis multiplex congenita affecting the hands, feet, ankle, shoulders and/or neck, with camptodactyly of the fingers and limited knee and hip extension, associated with asymmetric ptosis and, less frequently, other ocular manifestations (e.g. ophthalmoplegia, strabismus). Affected individuals frequently have a bulbous nose, furrowed tongue, micro/retrognathia, a short neck, congenital hip dislocation, club feet, scoliosis and short stature.",ENSG00000171551
HR,1,HEART,"","","","","",Orphanet_701,0.751530332653862,"Alopecia universalis: The most severe form of alopecia areata, an inflammatory disease of the hair follicle, which is characterized by a complete loss of hair of the scalp and all the hair-bearing areas of the body.",ENSG00000168453
DSP,1,HEART,"","","","","",Orphanet_158687,0.751417435342446,"Lethal acantholytic epidermolysis bullosa: Lethal acantholytic epidermolysis bullosa is a suprabasal subtype of epidermolysis bullosa simplex (EBS) characterized by generalized oozing erosions, usually in the absence of blisters.",ENSG00000096696
COL4A4,1,LUNG,"","","","","",Orphanet_63,0.750860154388464,"Alport syndrome: A genetic syndrome usually inherited as an X-link trait. It is caused by abnormalities in the COL4A5 gene. It affects males more often than females and is characterized by hematuria, progressive renal insufficiency, hearing loss, and ocular abnormalities.",ENSG00000081052
NEK8,1,ADRNL,"","","","","",Orphanet_294415,0.750479901689505,"Renal-hepatic-pancreatic dysplasia: Renal-hepatic-pancreatic dysplasia is a rare, genetic, developmental defect during embryogenesis syndrome characterized by the triad of pancreatic fibrosis (and cysts, with a reduction of parenchymal tissue), renal dysplasia (with peripheral cortical cysts, primitive collecting ducts, glomerular cysts and metaplastic cartilage) and hepatic dysgenesis (enlarged portal areas containing numerous elongated binary profiles with a tendancy to perilobular fibrosis). Situs abnormalities, skeletal anomalies and anencephaly have also been associated. Patients that survive the neonatal period present renal insufficiency, chronic jaundice and insulin-dependant diabetes.",ENSG00000160602
CSPP1,1,ADRNL,"","","","","",Orphanet_397715,0.749676780523539,"Joubert syndrome with Jeune asphyxiating thoracic dystrophy: Joubert syndrome with Jeune asphyxiating thoracic dystrophy (JATD) is an extremely rare genetic bone disorder characterized by the classic features of Joubert syndrome (i.e. malformation of the brainstem causing ataxia, hypotonia,cognitive impairment, and abnormal eyemovements), associated with the skeletal anomalies found in JATD including short-rib dysplasia and narrow thorax causing respiratory failure, short limbs, and metaphyseal changes.",ENSG00000104218
SETX,1,SPLEEN,"","","","","",Orphanet_357043,0.749653402346123,Amyotrophic lateral sclerosis type 4: Any amyotrophic lateral sclerosis in which the cause of the disease is a mutation in the SETX gene.,ENSG00000107290
WNK4,1,COLON,"","","","","",Orphanet_88939,0.748838219433655,Pseudohypoaldosteronism type 2B: Any pseudohypoaldosteronism type 2 in which the cause of the disease is a mutation in the WNK4 gene.,ENSG00000126562
SLC4A11,1,SPLEEN,"","","","","",Orphanet_1490,0.745874092433039,"Corneal dystrophy - perceptive deafness: Corneal dystrophy-perceptive deafness (CDPD) or Harboyan syndrome is a degenerative corneal disorder characterized by the association of congenital hereditary endothelial dystrophy (CHED) with progressive, postlingual sensorineural hearing loss.",ENSG00000088836
PTDSS1,1,COLON,"","","","","",Orphanet_2658,0.745467658018389,"Lenz-Majewski hyperostotic dwarfism: Lenz-Majewski hyperostotic dwarfism is an extremely rare syndrome associating dwarfism, characteristic facial appearance, cutis laxa and progressive bone sclerosis.",ENSG00000156471
SCN1B,1,ADRNL,"","","","","",Orphanet_36387,0.744919311333151,Generalized epilepsy with febrile seizures-plus: Generalized epilepsy with febrile seizures plus (GEFS+) is a familial epilepsy syndrome in which family members display a seizure disorder from the GEFS+ spectrum which ranges from simple febrile seizures (FS) to the more severe phenotype of myoclonic-astatic epilepsy (MAE) or Dravet syndrome (DS) (see these terms).,ENSG00000105711
CREBBP,1,SPLEEN,"","","","","",EFO_0010252,0.744557884137133,"Menke-Hennekam syndrome 1: A form of Menke-Hennekam syndrome, a congenital autosomal dominant disease characterized by developmental delay, growth retardation, and craniofacial dysmorphism. Patients have intellectual disability of variable severity, speech delay, autistic behavior, short stature and microcephaly. Main facial characteristics include short palpebral fissures, telecanthi, depressed nasal ridge, short nose, anteverted nares, short columella and long philtrum. Menke-Hennekam syndrome-1 (MKHK1) is caused by heterozygous mutation in exon 30 or 31 of the CREBBP gene.",ENSG00000005339
MAF,1,COLON,"","","","","",Orphanet_98984,0.744193667352654,Pulverulent cataract: A cataract that has material basis in heterozygous mutation in the CRYGC gene on chromosome 2q33.,ENSG00000178573
COLEC11,1,ADRNL,"","","","","",EFO_1001977,0.74416129388242,3MC syndrome 2: A type of 3MC syndrome which is that has material basis in homozygous mutation in the COLEC11 gene on chromosome 2p25.,ENSG00000118004
LTBP3,1,ADRNL,"","","","","",Orphanet_2899,0.743791929680628,"Brachyolmia-amelogenesis imperfecta syndrome: An exceedingly rare form of brachyolmia, characterized by mild platyspondyly, broad ilia, elongated femoral necks with coxa valga, scoliosis, and short trunked short stature associated with amelogenesis imperfecta of both primary and permanent dentition.",ENSG00000168056
MAF,1,COLON,"","","","","",Orphanet_98989,0.743731271274772,"Cerulean cataract: Cerulean cataract is a type of hereditary congenital cataract distinguished by bluish and white opacifications in the superficial layers of the fetal lens nucleus and adult lens nucleus and characterized by reduced visual acuity in childhood, eventually necessitating extraction of the lens.",ENSG00000178573
MMP2,1,ADRNL,"","","","","",Orphanet_3460,0.743726257545947,Torg-Winchester syndrome: NA,ENSG00000087245
MMP2,1,ADRNL,"","","","","",Orphanet_371428,0.743327383749988,"Multicentric osteolysis-nodulosis-arthropathy spectrum: A rare genetic chronic skeletal disorder characterized by peripheral osteolysis (especially carpal and tarsal bones), interphalangeal joint erosions, subcutaneous fibrocollagenous nodules, facial dysmorphism, and a wide range of associated manifestations.",ENSG00000087245
THBD,1,SMLINT,"","","","","",MONDO_0013775,0.742010607304013,thrombomodulin-related bleeding disorder: NA,ENSG00000178726
FAT4,1,COLON,"","","","","",Orphanet_2136,0.741669817787295,"Hennekam syndrome: Hennekam syndrome is characterised by the association of lymphoedema, intestinal lymphangiectasia, intellectual deficit and facial dysmorphism.",ENSG00000196159
IFNGR1,1,COLON,"","","","","",Orphanet_319569,0.741110269713573,"Autosomal recessive mendelian susceptibility to mycobacterial diseases due to partial IFNgammaR1 deficiency: Autosomal recessive (AR) mendelian susceptibility to mycobacterial diseases (MSMD) due to partial IFN-gammaR1 deficiency is a genetic variant of MSMD (see this term) characterized by a partial deficiency in IFN-gammaR1, leading to a residual response to IFN-gamma and, consequently, to recurrent, moderately severe infections with bacillus Calmette-Guérin (BCG) and other environmental mycobacteria (EM).",ENSG00000027697
IFNGR1,1,COLON,"","","","","",Orphanet_99898,0.741110269713573,"Mendelian susceptibility to mycobacterial diseases due to complete IFNgammaR1 deficiency: Mendelian susceptibility to mycobacterial diseases (MSMD) due to complete interferon gamma receptor 1 (IFN-gammaR1) deficiency is a genetic variant of MSMD characterized by a complete deficiency in IFN-gammaR1, leading to impaired IFN-gamma immunity and, consequently, to severe and often fatal infections with bacillus Calmette-GuC)rin (BCG) and other environmental mycobacteria (EM).",ENSG00000027697
CARMIL2,1,SPLEEN,"","","","","",MONDO_0029134,0.74033018651725,severe combined immunodeficiency due to CARMIL2 deficiency: NA,ENSG00000159753
SPART,1,SMLINT,"","","","","",Orphanet_101000,0.737885703281612,Autosomal recessive spastic paraplegia type 20: NA,ENSG00000133104
CFH,1,COLON,"","","","","",MONDO_0012350,0.737509765506504,complement factor H deficiency: NA,ENSG00000000971
LAMC3,1,LUNG,"","","","","",Orphanet_280640,0.735297589544988,Occipital pachygyria and polymicrogyria: NA,ENSG00000050555
GNS,1,ADRNL,"","","","","",Orphanet_581,0.734946588637414,Mucopolysaccharidosis type 3: Mucopolysaccharidosis type III (MPS III) is a lysosomal storage disease belonging to the group of mucopolysaccharidoses and characterised by severe and rapid intellectual deterioration.,ENSG00000135677
ATAD3A,1,COLON,"","","","","",MONDO_0014958,0.73491897899433,Harel-Yoon syndrome: NA,ENSG00000197785
SCNN1B,1,LUNG,"","","","","",Orphanet_171876,0.733685641338374,Generalized pseudohypoaldosteronism type 1: Generalized pseudohypoaldosteronism type 1 (generalized PHA1) is a severe form of primary mineralocorticoid resistance with systemic involvement and salt loss in multiple organs.,ENSG00000168447
LTBP4,1,HEART,"","","","","",Orphanet_221145,0.733473147164939,"Cutis laxa with severe pulmonary, gastrointestinal and urinary anomalies: A autosomal recessive cutis laxa type I that has material basis in homozygous or compound heterozygous mutation in the LTBP4 gene on chromosome 19q13",ENSG00000090006
CD247,1,SPLEEN,"","","","","",Orphanet_169160,0.733322809741603,T-B+ severe combined immunodeficiency due to CD3delta/CD3epsilon/CD3zeta: NA,ENSG00000198821
KRT14,1,COLON,"","","","","",Orphanet_69087,0.733235643517868,"Naegeli-Franceschetti-Jadassohn syndrome: Naegeli-Franceschetti-Jadassohn (NFJ) syndrome is a rare ectodermal dysplasia that affects the skin, sweat glands, nails, and teeth.",ENSG00000186847
FAT4,1,COLON,"","","","","",Orphanet_314679,0.732970739623995,"Cerebro-facio-articular syndrome: Cerebrofacioarticular syndrome is a rare multiple congenital anomalies syndrome characterized by mild to severe intellectual disability, a distinctive facial gestalt (blepharophimosis, maxillary hypoplasia, telecanthus, microtia and atresia of the external auditory meatus) as well as skeletal and articular abnormalities (e.g. camptodactyly of the fingers, cutaneous syndactyly, talipes equinovarus, flexion contractures of the proximal interphalangeal joints, hip or elbow subluxation, joint laxity). Affected individuals also present neonatal hypotonia, variable respiratory manifestations, chronic feeding difficulties and gray matter heterotopia.",ENSG00000196159
SLC3A1,1,ADRNL,"","","","","",Orphanet_93612,0.732607701904805,Cystinuria type A: NA,ENSG00000138079
MTHFD1,1,SPLEEN,"","","","","",MONDO_0060611,0.732387133791218,combined immunodeficiency and megaloblastic anemia with or without hyperhomocysteinemia: NA,ENSG00000100714
SCNN1B,1,LUNG,"","","","","",MONDO_0008887,0.731328660039201,bronchiectasis with or without elevated sweat chloride 1: NA,ENSG00000168447
PLAA,1,ADRNL,"","","","","",MONDO_0060502,0.729022670791121,"neurodevelopmental disorder with progressive microcephaly, spasticity, and brain anomalies: NA",ENSG00000137055
CHRDL1,1,KIDNEY,"","","","","",Orphanet_91489,0.726532397667676,"Isolated congenital megalocornea: Isolated congenital megalocornea is a genetic, non-syndromic developmental defect of the anterior eye segment characterized by bilateral enlargement of the corneal diameter (>12.5 mm) and a deep anterior eye chamber, without an elevation in intraocular pressure. It can manifest with mild to moderate myopia as well as photophobia and iridodonesis (due to iris hypoplasia). Associated complications include lens dislocation, retinal detachment, presenile cataract development, and secondary glaucoma.",ENSG00000101938
NTNG2,1,SPLEEN,"","","","","",EFO_0010658,0.72493323809215,"neurodevelopmental disorder with behavioral abnormalities, absent speech, and hypotonia: An autosomal recessive disorder characterized by global developmental delay with severely impaired intellectual development, impaired motor development, axial and peripheral hypotonia, poor speech and significant behavioral abnormalities, including autism spectrum disorder, hyperactivity, mood disorders, aggression, hand and face stereotypies, sleep disturbances, anxiety, self-injurious behavior, and bruxism.",ENSG00000196358
IGSF1,1,HEART,"","","","","",Orphanet_329235,0.724870530951021,"X-linked central congenital hypothyroidism with late-onset testicular enlargement: An X-linked recessive syndrome caused by loss-of-function mutation(s) in IGSF1, encoding immunoglobulin superfamily member 1. This condition can result in central hypothyroidism, macroorchidism, delayed puberty, and variable prolactin deficiency.",ENSG00000147255
GFI1,1,SPLEEN,"","","","","",Orphanet_486,0.723872633937682,Autosomal dominant severe congenital neutropenia: Autosomal dominant form of severe congenital neutropenia.,ENSG00000162676
CSF2RA,1,LUNG,"","","","","",Orphanet_264675,0.723514162187751,"Congenital pulmonary alveolar proteinosis: Congenital pulmonary alveolar proteinosis is a very rare primary interstitial lung disease due to pulmonary surfactant accumulation within the alveolar macrophages and alveoli, characterized by a variable clinical course ranging from an asymptomatic clinical presentation and spontaneous remission, to symptoms such as dyspnea and cough, or to severe respiratory failure.",ENSG00000198223
ATP2A2,1,ADRNL,"","","","","",Orphanet_218,0.723339046329408,Darier disease: Darier disease (DD) is a keratinization disorder characterized by the development of keratotic papules in seborrheic areas and specific nail anomalies.,ENSG00000174437
BRCA2,1,ADRNL,"","","","","",MONDO_0011584,0.722574243051146,"Fanconi anemia complementation group D1: Inherited cancer-predisposing syndrome due to biallelic BRCA2 mutations is a rare cancer-predisposing syndrome, associated with the D1 subgroup of Fanconi anemia (FA), characterized by progressive bone marrow failure, cardiac, brain, intestinal or skeletal abnormalities and predisposition to various malignancies. Bone marrow suppression and the incidence of developmental abnormalities are less frequent than in other FA, but cancer risk is very high with the spectrum of childhood cancers including Wilms tumor, brain tumor (often medulloblastoma) and ALL/AML.",ENSG00000139618
AP1S1,1,ADRNL,"","","","","",Orphanet_171851,0.72178227852359,"MEDNIK syndrome: MEDNIK syndrome, previously known as Erythrokeratodermia Variabilis type 3 (EKV3), is characterized by intellectual deficit, enteropathy, sensorineural hearing loss, peripheral neuropathy, lamellar and erythrodermic ichthyosis, and keratodermia (MEDNIK stands for Mental retardation, Enteropathy, Deafness, peripheral Neuropathy, Ichtyosis, Keratodermia).",ENSG00000106367
CFP,1,SMLINT,"","","","","",Orphanet_2966,0.721705496960916,"Properdin deficiency: A rare, hereditary, primary immunodeficiency due to a complement cascade protein anomaly characterized by significantly increased susceptibility to Neisseria species infections. It only affects males, typically presenting with severe or fulminant meningococcal disease.",ENSG00000126759
KIF21A,1,LIVER,"","","","","",EFO_1001985,0.720760660781937,congenital fibrosis of the extraocular muscles: NA,ENSG00000139116
TOP3A,1,ADRNL,"","","","","",MONDO_0020628,0.720349205472605,"microcephaly, growth restriction, and increased sister chromatid exchange 2: NA",ENSG00000177302
LMBR1,1,ADRNL,"","","","","",Orphanet_2378,0.719615226126998,"Laurin-Sandrow syndrome: Laurin-Sandrow syndrome (LSS) is characterised by complete polysyndactyly of the hands, mirror feet and nose anomalies (hypoplasia of the nasal alae and short columella), often associated with ulnar and/or fibular duplication (and sometimes tibial agenesis). It has been described in less than 20 cases. Some cases with the same clinical signs but without nasal defects have also been reported, and may represent the same entity. The etiology of LSS is unknown. Different modes of inheritance have been suggested.",ENSG00000105983
GMPPB,1,COLON,"","","","","",Orphanet_370953,0.719112568779527,Congenital muscular dystrophy due to dystroglycanopathy: NA,ENSG00000173540
ABCA3,1,ADRNL,"","","","","",Orphanet_264675,0.718625036517021,"Congenital pulmonary alveolar proteinosis: Congenital pulmonary alveolar proteinosis is a very rare primary interstitial lung disease due to pulmonary surfactant accumulation within the alveolar macrophages and alveoli, characterized by a variable clinical course ranging from an asymptomatic clinical presentation and spontaneous remission, to symptoms such as dyspnea and cough, or to severe respiratory failure.",ENSG00000167972
SCNN1B,1,LUNG,"","","","","",Orphanet_526,0.718420028053986,"Liddle syndrome: Liddle syndrome is a rare inherited form of hypertension characterized by severe early-onset hypertension associated with decreased plasmatic levels of potassium, renin and aldosterone.",ENSG00000168447
FUT8,1,COLON,"","","","","",MONDO_0060720,0.717878920547891,congenital disorder of glycosylation with defective fucosylation: NA,ENSG00000033170
ABCA3,1,ADRNL,"","","","","",MONDO_0001437,0.717481049627059,"pulmonary alveolar proteinosis: A rare lung disorder characterized by the filling of the pulmonary alveoli with proteinaceous material which stains positive with periodic acid-Schiff stain. It may be idiopathic or secondary due to hematologic malignancies or the inhalation of mineral dusts. Signs and symptoms include dyspnea, cough and low grade fever.",ENSG00000167972
HR,1,HEART,"","","","","",Orphanet_86819,0.716246407913983,"Atrichia with papular lesions: Atrichia with papular lesions is a rare inherited form of alopecia characterized by irreversible hair loss during the neonatal period on all hear-bearing areas of the body, later associated with the development of papular lesions all over the body and preferentially on the face and extensor surfaces of the extremities.",ENSG00000168453
KMT2E,1,SPLEEN,"","","","","",EFO_0010277,0.715865219418578,"O'Donnell-Luria-Rodan syndrome: A neurodevelopmental disorder characterized by global developmental delay, speech delay, intellectual disability and a subtle facial gestalt. Additional common features include autism, seizures, hypotonia and functional gastrointestinal abnormalities.",ENSG00000005483
MASP1,1,HEART,"","","","","",Orphanet_293843,0.715364065236413,Craniofacial-ulnar-renal syndrome: NA,ENSG00000127241
AMACR,1,LIVER,"","","","","",EFO_1001980,0.714526334521283,"Alpha-methylacyl-CoA racemase deficiency: A rare disorder caused by mutation in the AMACR gene. It is characterized by neurological abnormalities that appear in adulthood and include cognitive decline, seizures, and sensorimotor neuropathy.",ENSG00000242110
INF2,1,LIVER,"","","","","",Orphanet_656,0.714030093627498,Familial idiopathic steroid-resistant nephrotic syndrome: Familial idiopathic steroid-resistant nephrotic syndrome is characterized by a nephrotic syndrome with often early onset.,ENSG00000203485
KRT14,1,COLON,"","","","","",Orphanet_86920,0.713740293122214,Dermatopathia pigmentosa reticularis: NA,ENSG00000186847
COL4A1,1,HEART,"","","","","",Orphanet_99810,0.712059978052108,Familial porencephaly: An instance of porencephaly that is caused by an inherited modification of the individual's genome.,ENSG00000187498
LMBR1,1,ADRNL,"","","","","",Orphanet_3332,0.710782865381171,Hypoplastic tibiae - postaxial polydactyly: Hypoplastic tibia-polydactyly syndrome is a very rare congenital malformation syndrome characterized by bilateral hypoplasia of the tibia with polydactyly of the feet and hands.,ENSG00000105983
