gene,n_tissue,tissue_1,tissue_2,tissue_3,tissue_4,tissue_5,tissue_6,direct_association.diseaseId,direct_association.score,direct_association.disease,ensembl_ID
PLAA,1,ADRNL,"","","","","",Orphanet_2523,0.461974818355877,"Microcephaly - brain defect - spasticity - hypernatremia: Microcephaly-brain defect-spasticity-hypernatremia syndrome is a rare congenital genetic syndrome with a central nervous system malformation as a major feature characterized by microcephaly, hypertonia, developmental delay and cognitive impairment, swallowing difficulty, hypernatremia, and hypoplasia of the frontal parts and fusion of the lateral ventricles on brain MRI. Only one familial case with three affected siblings reported and there have been no further descriptions in the literature since 1986.",ENSG00000137055
DGAT1,1,ADRNL,"","","","","",Orphanet_329242,0.461974818355877,"Congenital chronic diarrhea with protein-losing enteropathy: Congenital chronic diarrhea with protein-losing enteropathy is a rare, genetic, intestinal disease characterized by early-onset, chronic, non-infectious, non-bloody, watery diarrhea associated with protein-losing enteropathy which results in hypoalbuminemia, hypogammaglobulinemia and elevated stool alpha-1-antitrypsin. Patients typically present severe, intractable diarrhea, failure to thrive, recurrent infections and edema.",ENSG00000185000
SRSF2,1,COLON,"","","","","",MONDO_0044881,0.461974818355877,"hematopoietic and lymphoid cell neoplasm: A neoplasm arising from hematopoietic cells found in the bone marrow, peripheral blood, lymph nodes and spleen (organs of the hematopoietic system). Hematopoietic cell neoplasms can also involve other anatomic sites (e.g. central nervous system, gastrointestinal tract), either by metastasis, direct tumor infiltration, or neoplastic transformation of extranodal lymphoid tissues. The commonest forms are the various types of leukemia, Hodgkin and non-Hodgkin lymphomas, myeloproliferative neoplasms, and myelodysplastic syndromes.",ENSG00000161547
SLC39A7,1,COLON,"","","","","",MONDO_0002211,0.461974818355877,B cell deficiency: A broad classification of disorders where circulating numbers of B lymphocytes are decreased or ineffective. Complement components and the production of antibodies may also be deficient.,ENSG00000112473
SEC61A1,1,COLON,"","","","","",MONDO_0100337,0.461974818355877,"SEC61A1 deficiency: Any Mendelian disease in which the cause of the disease is a mutation in the SEC61A1 gene. It is characterized by variable presentation of phenotypes in patients, including autosomal dominant tubulointerstitial kidney disease, primary antibody deficiency, and severe congenital neutropenia.",ENSG00000058262
PGA5,1,COLON,"","","","","",HP_0004398,0.461974818355877,Peptic ulcer: An ulcer of the gastrointestinal tract.,ENSG00000256713
CNR1,1,COLON,"","","","","",HP_0002018,0.461974818355877,Nausea: A sensation of unease in the stomach together with an urge to vomit.,ENSG00000118432
HDAC5,1,COLON,"","","","","",MONDO_0015760,0.461974818355877,T-cell non-Hodgkin lymphoma: A non-Hodgkin lymphoma of T-cell lineage. It includes the T lymphoblastic lymphoma and the mature T- and NK-cell lymphomas. -- 2003,ENSG00000108840
LRP1,1,COLON,"","","","","",Orphanet_2340,0.461974818355877,"Keratosis follicularis spinulosa decalvans: Keratosis follicularis spinulosa decalvans is a rare genodermatosis occurring during infancy or childhood, predominantly affecting males, and characterized by diffuse follicular hyperkeratosis associated with progressive cicatricial alopecia of the scalp, eyebrows and eyelashes. Additional findings can include photophobia, corneal dystrophy, facial erythema, and/or palmoplantar keratoderma.",ENSG00000123384
LRP1,1,COLON,"","","","","",Orphanet_79100,0.461974818355877,Atrophoderma vermiculata: NA,ENSG00000123384
KLHL24,1,COLON,"","","","","",MONDO_0015006,0.461974818355877,"epidermolysis bullosa simplex 6, generalized, with scarring and hair loss: NA",ENSG00000114796
GABRA6,1,CORTEX,"","","","","",EFO_0005109,0.461974818355877,energy expenditure: energy expenditure is generally considered to be the sum of internal heat produced and external work through physical activity,ENSG00000145863
GABRA6,1,CORTEX,"","","","","",EFO_0009549,0.461974818355877,female reproductive system disease: A disease involving the female reproductive system.,ENSG00000145863
GABRA6,1,CORTEX,"","","","","",EFO_0009659,0.461974818355877,aneurysm: Bulging or ballooning in an area of an artery secondary to arterial wall weakening. [ NCI ],ENSG00000145863
GABRA6,1,CORTEX,"","","","","",EFO_1001311,0.461974818355877,End Stage Liver Disease: Final stage of a liver disease when the liver failure is irreversible and LIVER TRANSPLANTATION is needed.,ENSG00000145863
GABRA6,1,CORTEX,"","","","","",EFO_1001801,0.461974818355877,intracranial subdural hematoma: Accumulation of blood in the SUBDURAL SPACE over the CEREBRAL HEMISPHERE.,ENSG00000145863
MYPN,1,HEART,"","","","","",MONDO_0015023,0.461974818355877,"MYPN-related myopathy: Congenital myopathy caused by pathogenic mutations in MYPN that lead to a wide spectrum of phenotypes. Patients with mutations in this gene often experience muscle weakness, facial weakness, and sometimes cardiac and respiratory issues. Histological findings on skeletal muscle biopsy are variable with nemaline bodies and cap-like lesions.",ENSG00000138347
KCNK3,1,HEART,"","","","","",EFO_0002615,0.461974818355877,"internal carotid artery stenosis: Carotid stenosis is a narrowing or constriction of the inner surface (lumen) of the carotid artery, usually caused by atherosclerosis. The internal carotid artery supplies the brain. Plaque often builds up at that division, and causes a narrowing (stenosis). Pieces of plaque can break off and block the small arteries above in the brain, which causes a stroke. Plaque can also build up at the origin of the carotid artery at the aorta.",ENSG00000171303
KCNK3,1,HEART,"","","","","",EFO_0003917,0.461974818355877,"premature birth: CHILDBIRTH before 37 weeks of PREGNANCY (259 days from the first day of the mother's last menstrual period, or 245 days after FERTILIZATION).",ENSG00000171303
RNF13,1,HEART,"","","","","",HP_0100704,0.461974818355877,Cerebral visual impairment: A form of loss of vision caused by damage to the visual cortex rather than a defect in the eye.,ENSG00000082996
ADRA1B,1,HEART,"","","","","",EFO_0002497,0.461974818355877,acute hypotension: Acute form of hypotension (disease).,ENSG00000170214
ADRA1B,1,HEART,"","","","","",EFO_0005758,0.461974818355877,"cycloplegia: Cycloplegia is paralysis of the ciliary muscle of the eye, resulting in a loss of accommodation.",ENSG00000170214
ADRA1B,1,HEART,"","","","","",EFO_0007450,0.461974818355877,"poliomyelitis: An acute infectious disorder that affects the nervous system. It is caused by the poliovirus. The virus spreads by direct contact, and can be prevented by prophylaxis with the polio vaccine.",ENSG00000170214
ADRA1B,1,HEART,"","","","","",HP_0001662,0.461974818355877,"Bradycardia: A slower than normal heart rate (in adults, slower than 60 beats per minute).",ENSG00000170214
GRIN2D,1,HIPPOC,"","","","","",EFO_0020000,0.461974818355877,"developmental and epileptic encephalopathy 94: Developmental and epileptic encephalopathy-94 (DEE94) is a severe form of epilepsy characterized by onset of multiple seizure types in the first few years of life and associated with poor prognosis. Affected individuals have cognitive regression and impaired intellectual development (summary by Carvill et al., 2013).",ENSG00000105464
BTD,1,LIVER,"","","","","",EFO_0005596,0.461974818355877,vitamin metabolic disorder: An inherited metabolic disorder resulting from a deficiency in vitamin or vitamin cofactor transport or metabolism.,ENSG00000169814
MALT1,1,LUNG,"","","","","",Orphanet_397964,0.461974818355877,"Combined immunodeficiency due to MALT1 deficiency: Combined immunodeficiency due to MALT1 deficiency is a rare, genetic form of primary immunodeficiency characterized by growth retardation, early recurrent pulmonary infections leading to bronchiectasis, inflammatory gastrointestinal disease, and other symptoms, such as rash, dermatitis, skin infections.",ENSG00000172175
CSF2RA,1,LUNG,"","","","","",GO_0002524,0.461974818355877,hypersensitivity: NA,ENSG00000198223
PTPRC,1,SPLEEN,"","","","","",Orphanet_317416,0.461974818355877,"T-B+ severe combined immunodeficiency: T-B+ severe combined immunodeficiency (SCID) is a group of rare monogenic primary immunodeficiency disorders characterized by a lack of functional peripheral T lymphocytes with presence of B lymphocytes, resulting in early-onset severe respiratory viral, bacterial or fungal infections, diarrhea and failure to thrive.",ENSG00000081237
CD247,1,SPLEEN,"","","","","",Orphanet_317416,0.461974818355877,"T-B+ severe combined immunodeficiency: T-B+ severe combined immunodeficiency (SCID) is a group of rare monogenic primary immunodeficiency disorders characterized by a lack of functional peripheral T lymphocytes with presence of B lymphocytes, resulting in early-onset severe respiratory viral, bacterial or fungal infections, diarrhea and failure to thrive.",ENSG00000198821
CD3E,1,SPLEEN,"","","","","",Orphanet_317416,0.461974818355877,"T-B+ severe combined immunodeficiency: T-B+ severe combined immunodeficiency (SCID) is a group of rare monogenic primary immunodeficiency disorders characterized by a lack of functional peripheral T lymphocytes with presence of B lymphocytes, resulting in early-onset severe respiratory viral, bacterial or fungal infections, diarrhea and failure to thrive.",ENSG00000198851
JAK3,1,SPLEEN,"","","","","",EFO_0005565,0.461974818355877,janus kinase-3 deficiency: Deficiency of janus kinase-3 causing the near absence of T lymphocytes and Natural killer cells; and normal or elevated B lymphocytes due to an autosomal recessive variant of severe combined immunodeficiency.,ENSG00000105639
JAK3,1,SPLEEN,"","","","","",Orphanet_317416,0.461974818355877,"T-B+ severe combined immunodeficiency: T-B+ severe combined immunodeficiency (SCID) is a group of rare monogenic primary immunodeficiency disorders characterized by a lack of functional peripheral T lymphocytes with presence of B lymphocytes, resulting in early-onset severe respiratory viral, bacterial or fungal infections, diarrhea and failure to thrive.",ENSG00000105639
VWF,1,LUNG,"","","","","",EFO_0004629,0.461621709085128,"von Willebrand factor measurement: Is a quantification of von Willebrand factor (vWF) is a blood glycoprotein involved in hemostasis. It is deficient or defective in von Willebrand disease and is involved in a large number of other diseases, including thrombotic thrombocytopenic purpura, Heyde's syndrome, and possibly hemolytic-uremic syndrome.[1] Increased plasma levels in a large number of cardiovascular, neoplastic, and connective tissue diseases are presumed to arise from adverse changes to the endothelium, and may contribute to an increased risk of thrombosis.",ENSG00000110799
SLC18A2,1,ADRNL,"","","","","",Orphanet_238455,0.460572981434844,Infantile dystonia-parkinsonism: Infantile dystonia-parkinsonism (IPD) is an extremely rare inherited neurological syndrome that presents in early infancy with hypokinetic parkinsonism and dystonia and that can be fatal.,ENSG00000165646
DPP6,1,LUNG,"","","","","",Orphanet_228140,0.460126919082454,"Idiopathic ventricular fibrillation, not Brugada type: NA",ENSG00000130226
PLA2G7,1,HEART,"","","","","",HP_0040175,0.457465944128724,Platelet-activating factor acetylhydrolase deficiency: Reduced level of platelet-activating factor acetylhydrolase.,ENSG00000146070
KMT2C,1,SPLEEN,"","","","","",Orphanet_261652,0.454583221262183,Kleefstra syndrome due to a point mutation: NA,ENSG00000055609
PSMB9,1,ADRNL,"","","","","",MONDO_0054699,0.453197296807116,proteasome-associated autoinflammatory syndrome 3: NA,ENSG00000240065
ABCA3,1,ADRNL,"","","","","",Orphanet_100049,0.45273532198876,Primary interstitial lung disease specific to childhood due to pulmonary surfactant protein anomalies: Primary interstitial lung disease specific to childhood due to pulmonary surfactant protein anomalies is a group of interstitial lung diseases (ILD) induced by genetic mutations disrupting surfactant function and gas exchange in the lung. The disorders caused by these mutations affect full-term infants and older children and exhibit considerable overlap in their clinical and histologic presentation.,ENSG00000167972
LMBR1,1,ADRNL,"","","","","",HP_0010689,0.45273532198876,"Mirror image polydactyly: A hand or foot with more than five digits that has a recognizable A/P axis of symmetry. The axis can lie within a normally formed or partially duplicated digit resembling a middle finger, index finger, thumb, toe, or hallux. Alternatively, the axis can be in an interdigital space with a flanking pair of digits that resemble a middle finger, index finger, thumb, toe or hallux. The most lateral digits on each side of the hand typically resemble fifth fingers/toes.",ENSG00000105983
SREBF1,1,KIDNEY,"","","","","",Orphanet_2273,0.45273532198876,"Ichthyosis follicularis - alopecia - photophobia: Ichthyosis follicularis - alopecia - photophobia (IFAP) is a rare genetic disorder characterized by the triad of ichthyosis follicularis, alopecia, and photophobia from birth.",ENSG00000072310
SREBF1,1,KIDNEY,"","","","","",Orphanet_85284,0.45273532198876,"BRESEK syndrome: X-linked mental retardation, Reish type is characterised by Brain anomalies, severe mental Retardation, Ectodermal dysplasia, Skeletal deformities (vertebral anomalies, scoliosis, polydactyly), Ear/eye anomalies (maldevelopment, small optic nerves, low set and large ears with hearing loss) and Kidney dysplasia/hypoplasia (giving the acronym BRESEK syndrome).",ENSG00000072310
MMACHC,1,HEART,"","","","","",Orphanet_289098,0.451699030192917,Disorders of vitamin D metabolism: NA,ENSG00000132763
PDE4B,1,SPLEEN,"","","","","",EFO_0010098,0.448556280654138,"stress-related disorder: Stress-related disorders are mental health disorders that are a result of an atypical response to both short and long-term anxiety due to physical, mental, or emotional stress.",ENSG00000184588
FRAS1,1,KIDNEY,"","","","","",Orphanet_2190,0.447383189726501,Congenital hydronephrosis: Congenital hydronephrosis is a renal urinary disease characterized by distension and dilation of the renal pelvis and calyces secondary to various congenital obstructive malformations of the kidneys and urinary tract that can evolve to renal atrophy.,ENSG00000138759
AMACR,1,LIVER,"","","","","",Orphanet_79303,0.445642599672575,"Congenital bile acid synthesis defect type 2: Congenital bile acid synthesis defect type 2 (BAS defect type 2) is an anomaly of bile acid synthesis (see this term) characterized by severe and rapidly progressive cholestatic liver disease, and malabsorption of fat and fat-soluble vitamins.",ENSG00000242110
SCN1A,1,HEART,"","","","","",Orphanet_3175,0.445343724895066,Spasticity - intellectual disability - X-linked epilepsy: NA,ENSG00000144285
SCN1A,1,HEART,"","","","","",Orphanet_364063,0.445343724895066,"Infantile epileptic-dyskinetic encephalopathy: Infantile epileptic-dyskinetic encephalopathy is a monogenic disease with epilepsy characterized by developmental delay and infantile spasms in the first months of life, followed by chorea and generalized dystonia and progressing to quadriplegic dyskinesia, recurrent status dystonicus, intractable focal epilepsy and severe intellectual disability.",ENSG00000144285
CD80,1,LUNG,"","","","","",EFO_0000398,0.444548101596786,dermatomyositis: A myositis and is_a dermatitis that results_in inflammation located_in muscle and located_in skin. The disease may result from either a viral infection or an autoimmune reaction.,ENSG00000121594
IFNGR1,1,COLON,"","","","","",Orphanet_2781,0.442469214914185,"Osteopetrosis: Osteopetrosis, also known as marble bone disease, is a descriptive term that refers to a group of rare, heritable disorders of the skeleton characterized by increased bone density on radiographs.",ENSG00000027697
ITPR1,1,KIDNEY,"","","","","",EFO_1000635,0.43786871297064,hemangioma: A benign vascular lesion characterized by the formation of capillary-sized or cavernous vascular channels.,ENSG00000150995
TCHH,1,ADRNL,"","","","","",Orphanet_1410,0.436268486241141,"Uncombable hair syndrome: Uncombable hair syndrome (UHS), or pili trianguli et canaliculi, is a rare scalp hair shaft dysplasia.",ENSG00000159450
BRCA2,1,ADRNL,"","","","","",EFO_0006387,0.436193337873397,cystadenocarcinoma: A malignant cystic epithelial neoplasm arising from the glandular epithelium. The malignant epithelial cells invade the stroma. The cystic spaces contain serous or mucinous fluid. Representative examples include ovarian and pancreatic cystadenocarcinomas.,ENSG00000139618
VEGFA,1,HEART,"","","","","",MONDO_0001941,0.435365068818579,blindness (disorder): The lack of vision. It is caused by neurological or physiological factors.,ENSG00000112715
COL4A3,1,HEART,"","","","","",EFO_0010967,0.434998777378745,urinary microalbumin measurement: The quantification of microalbumin in urine.,ENSG00000169031
PDE5A,1,ADRNL,"","","","","",EFO_1000899,0.434810699036552,diastolic heart failure: Heart failure caused by abnormal myocardial relaxation during DIASTOLE leading to defective cardiac filling.,ENSG00000138735
ADRA1B,1,HEART,"","","","","",HP_0002239,0.434256329254525,Gastrointestinal hemorrhage: Hemorrhage affecting the gastrointestinal tract.,ENSG00000170214
IFT140,1,ADRNL,"","","","","",Orphanet_1515,0.43362660624657,"Cranioectodermal dysplasia: Cranioectodermal dysplasia (CED) is a rare developmental disorder characterized by congenital skeletal and ectodermal defects associated with dysmorphic features, nephronophthisis, hepatic fibrosis and ocular anomalies (mainly retinitis pigmentosa).",ENSG00000187535
FCSK,1,COLON,"","","","","",MONDO_0060720,0.433282952153309,congenital disorder of glycosylation with defective fucosylation: NA,ENSG00000157353
FUT8,1,COLON,"","","","","",EFO_0004999,0.432634302488617,N-glycan measurement: The quantification of N-glycans in a plasma sample.,ENSG00000033170
RHOH,1,SPLEEN,"","","","","",Orphanet_324294,0.432140651642356,"T-cell immunodeficiency with epidermodysplasia verruciformis: T-cell immunodeficiency with epidermodysplasia verruciformis is a rare primary immunodeficiency characterized by increased susceptibility to infection by human papillomavirus, presenting in childhood with disseminated flat wart-like cutaneous lesions. Burkitt lymphoma has also been reported. Whilst total T-cell counts are normal, there is impaired TCR signaling, profound peripheral naive T-cell lymphopenia with memory T-cells displaying an exhaustion phenotype.",ENSG00000168421
HSPA9,1,HEART,"","","","","",Orphanet_98362,0.428917953575746,Constitutional sideroblastic anemia: NA,ENSG00000113013
TREH,1,COLON,"","","","","",Orphanet_103909,0.428235257455286,"Diarrhea-vomiting due to trehalase deficiency: This syndrome is characterised by diarrhoea and vomiting after ingestion of trehalose, a disaccharide found mainly in mushrooms.",ENSG00000118094
NR2F2,1,COLON,"","","","","",Orphanet_393,0.427795149444999,"46,XX testicular disorder of sex development: 46,XX testicular disorder of sex development (46,XX testicular DSD) is characterized by male external genitalia, ranging from normal to ambiguous with associated testosterone deficiency.",ENSG00000185551
NOTCH3,1,LUNG,"","","","","",MONDO_0005475,0.426690208340563,migraine with aura: A migraine disorder characterized by episodes that are preceded by focal neurological symptoms.,ENSG00000074181
KMT2A,1,SPLEEN,"","","","","",Orphanet_2322,0.426306381119626,"Kabuki syndrome: Kabuki syndrome (KS) is a multiple congenital anomaly syndrome characterized by typical facial features, skeletal anomalies, mild to moderate intellectual disability and postnatal growth deficiency.",ENSG00000118058
MYH10,1,SPLEEN,"","","","","",HP_0000445,0.425016832887407,"Wide nose: Interalar distance more than two standard deviations above the mean for age, i.e., an apparently increased width of the nasal base and alae.",ENSG00000133026
MYH10,1,SPLEEN,"","","","","",HP_0011800,0.425016832887407,"Midface retrusion: Posterior positions and/or vertical shortening of the infraorbital and perialar regions, or increased concavity of the face and/or reduced nasolabial angle.",ENSG00000133026
MTHFR,1,HEART,"","","","","",Orphanet_3388,0.42493812328135,Neural tube defect: A congenital defect characterized by failure of the neural tube to close completely; this results in the presence of openings in the brain or spinal cord. Examples of neural tube defects include encephalocele and spina bifida.,ENSG00000177000
IFT140,1,ADRNL,"","","","","",Orphanet_93426,0.424290608472952,Short rib dysplasia: NA,ENSG00000187535
CCND1,1,LIVER,"","","","","",EFO_0008366,0.42404670076794,IgG isotype profile measurement: quantification of immunoglobulin G in a sample as light chain or heavy chain or kappy type or lambda type,ENSG00000110092
MYLK,1,LUNG,"","","","","",Orphanet_2604,0.423168933613984,"Familial visceral myopathy: Familial visceral myopathy is a rare hereditary myopathic degeneration of both gastrointestinal and urinary tracts that causes chronic intestinal pseudo-obstruction. It usually presents after the first decade of life with megaduodenum, megacystis and symptoms such as abdominal distension and/or pain, vomiting, constipation, diarrhea, dysphagia, and/or urinary tract infections.n.",ENSG00000065534
SRSF2,1,COLON,"","","","","",EFO_1001934,0.4226727592682,adult acute myeloid leukemia: An acute myeloid leukemia occurring in adults.,ENSG00000161547
SMOC1,1,ADRNL,"","","","","",EFO_0004841,0.420424092809026,digit length ratio: Is the ratio of 2D:4D used a a marker for prenatal androgen exposure.,ENSG00000198732
MSR1,1,ADRNL,"","","","","",EFO_0010241,0.417732589865822,galectin-3-binding protein measurement: Quantification of the amount of galectin-3-binding protein in a sample.,ENSG00000038945
CFAP52,1,LUNG,"","","","","",Orphanet_101063,0.417715046502646,"Situs inversus totalis: A congenital condition in which there is complete right-to-left reversal of the position of the major thoracic and abdominal organs (that is, they are arranged in a mirror image of the normal positioning).",ENSG00000166596
CHDH,1,KIDNEY,"","","","","",EFO_0008176,0.417602797824959,interleukin 17 receptor B measurement: quantification of the amount of interleukin 17 receptor B in a sample,ENSG00000016391
TRPM4,1,LUNG,"","","","","",Orphanet_308166,0.417356263788359,"Erythrokeratoderma variabilis progressiva: A type of erythrokeratoderma characterized by the association of hyperkeratosis and erythema in persistent, although sometimes variable, circumscribed lesions. Progressive symmetric erythrokeratoderma (PSEK) and erythrokeratoderma variabilis (EKV) are probably no longer two distinctive diseases but rather the two clinical manifestations of a same disease, now known as EKVP.",ENSG00000130529
LGALS3,1,SPLEEN,"","","","","",EFO_0008137,0.416911833288014,galectin-3 measurement: quantification of the amount of galectin-3 in a sample,ENSG00000131981
PAK1,1,LUNG,"","","","","",MONDO_0700092,0.41648843274349,"neurodevelopmental disorder: A behavioral and cognitive disorder with onset during the developmental period that involves impaired or aberrant development of intellectual, motor, or social functions.",ENSG00000149269
PRKG2,1,HEART,"","","","","",Orphanet_93437,0.416146916374974,"Acromesomelic dysplasia: A group of extremely rare, inherited, progressive skeletal conditions that result in a particular form of short stature, called short-limb dwarfism. The short stature is the result of unusually short forearms and forelegs (mesomelia) and abnormal shortening of the bones in the hands and feet (acromelia). At birth, the hands and feet may appear abnormally short and broad. Over time, the apparent disproportion becomes even more obvious, especially during the first years of life. Additional features may include: limited extension of the elbows and arms; progressive abnormal curvature of the spine; an enlarged head; and a slightly flattened midface. Acromesomelic dysplasia is inherited as an autosomal recessive trait. There are different types of acromesomelic dysplasia, which are distinguished by their genetic cause. To read more about the different types, click on the links below. Acromesomelic dysplasia, Maroteaux type Acromesomelic dysplasia, Hunter-Thompson type Acromesomelic dysplasia, Grebe type",ENSG00000138669
SLC6A5,1,ADRNL,"","","","","",HP_0002267,0.415777336520289,"Exaggerated startle response: An exaggerated startle reaction in response to a sudden unexpected visual or acoustic stimulus, or a quick movement near the face.",ENSG00000165970
FARSA,1,COLON,"","","","","",Orphanet_178506,0.415777336520289,"Brain calcification, Rajab type: NA",ENSG00000179115
DUOXA2,1,COLON,"","","","","",Orphanet_79118,0.415777336520289,Neonatal diabetes - congenital hypothyroidism - congenital glaucoma - hepatic fibrosis - polycystic kidneys: NA,ENSG00000140274
RUBCN,1,HEART,"","","","","",HP_0002987,0.415777336520289,"Elbow flexion contracture: A chronic loss of elbow joint motion due to structural changes in muscle, tendons, ligaments, or skin that prevent normal movement of the joints of the elbow.",ENSG00000145016
